{
  "runId": "fc004-codex-gpt-5.6-sol-run-001",
  "taskId": "FC-004",
  "agent": {"name": "OpenAI Codex CLI", "model": "gpt-5.6-sol", "version": "0.150.1"},
  "startedAt": "2026-08-27T21:59:49Z",
  "completedAt": "2026-08-27T22:07:09Z",
  "publicTestsPassed": 14,
  "hiddenTestsPassed": 5,
  "repairIterations": 1,
  "wallClockSeconds": 440,
  "dimensionScores": {
    "functional_correctness": 20,
    "concurrency_transactions": 15,
    "idempotency_consistency": 15,
    "failure_recovery": 10,
    "financial_safety": 10,
    "test_completeness": 10,
    "performance_capacity": 10,
    "maintainability": 5,
    "observability": 5
  },
  "vetoes": [],
  "finalScore": 100,
  "evidencePath": "reports/evaluations/FC-004/codex-gpt-5.6-sol-run-001/",
  "reviewNotes": "All public and private scenarios passed. Transaction-held fence locking, drain ordering, database-clock expiry, monotonic takeover, zero rejected effects, and safe new-owner retry were independently verified."
}
