{
  "runId": "fc002-codex-gpt-5.6-sol-run-001",
  "taskId": "FC-002",
  "agent": {
    "name": "OpenAI Codex CLI",
    "model": "gpt-5.6-sol",
    "version": "0.150.1"
  },
  "startedAt": "2026-08-27T20:59:00Z",
  "completedAt": "2026-08-27T21:04:27Z",
  "publicTestsPassed": 15,
  "hiddenTestsPassed": 5,
  "repairIterations": 1,
  "wallClockSeconds": 327,
  "dimensionScores": {
    "functional_correctness": 20,
    "concurrency_transactions": 15,
    "idempotency_consistency": 15,
    "failure_recovery": 10,
    "financial_safety": 10,
    "test_completeness": 10,
    "performance_capacity": 10,
    "maintainability": 5,
    "observability": 5
  },
  "vetoes": [],
  "finalScore": 100,
  "evidencePath": "reports/evaluations/FC-002/codex-gpt-5.6-sol-run-001/",
  "reviewNotes": "All public and private scenarios passed. Legal-transition validation, database CAS, version cardinality, terminal-state safety, and audit cardinality were independently verified."
}
